{"counts":{"test":15,"train":50,"validation":10},"dataset_registry_hash":"0933ad65870a245a5fa441ddb657d40ed8f76e854c12286b17e753148fcdaf50","feature_registry_hash":"0d8612707c6673060546511d8f5e8d1ba47048ef440e6c2dcf238fdc297f6e0c","manifest_hash":"7540472038e5d04edc68f78b50db62fe2d650d83e717d83f492899bcb1453a35","parameter_space_hash":"605679294caea090c8a78a5c93f3b816cb2aff05251b33446a7e312e83c205fc","per_chromosome":{"chr18":{"test":3,"train":10,"validation":2},"chr19":{"test":3,"train":10,"validation":2},"chr20":{"test":3,"train":10,"validation":2},"chr21":{"test":3,"train":10,"validation":2},"chr22":{"test":3,"train":10,"validation":2}},"salt":"minos-l2-split-v1","samples":[{"allocation_digest":"4f717b41b27b6d5c721403ba61c8b1846ce819e597b9e619271fe649946515a4","bai_sha256":"7ab4e53a99e5019087166fd8cf4cbf320e63df08437c963518bd8d385e84d1a4","bam_sha256":"7780cdbae0e1ac6f8885f72d62b43712970be2e61b55553a0b221120739d5076","bam_size_bytes":115205647,"chromosome":"chr18","dataset_id":"minos-chr18-028662fb934529d7","fai_sha256":"1e9dac505c1b48f7a1ca90c5ec7e75ed257a19d4c03b21f4c40e4dfa29b806b5","feature_registry_hash":"0d8612707c6673060546511d8f5e8d1ba47048ef440e6c2dcf238fdc297f6e0c","identity_tuple_hash":"0713db5917cf4b8fca5fb3e663d4b07320ecf144aa20f4e46d65339ee01edb76","parameter_space_hash":"605679294caea090c8a78a5c93f3b816cb2aff05251b33446a7e312e83c205fc","partition":"train","reference_sha256":"4c37db9609b3e865e35128fb065f61eea1c83c815386c4631b03820f9b8265d2","region_contig":"chr18","region_coordinate_system":"zero_based_half_open","region_end0_exclusive":80373285,"region_hash":"5e29a21a684490bdbb8965e29a005ae8839a6a55c0ac82c8882b279f3b8dfc7f","region_length_bp":80373285,"region_source":"chr18:0-80373285","region_start0":0,"round_id":"028662fb934529d7","sort_order":3,"split_algorithm_version":"layer2-dataset-split-v1","split_salt":"minos-l2-split-v1"},{"allocation_digest":"5b3f501584906be3c6045ff9a86ddd164e6bf97ca8de5f540cdb7db9c012be39","bai_sha256":"e270ccee7d1871ddbfb23a0f6ea63f841781e12b05521285f4917051ad512d5c","bam_sha256":"7b520386beb0e3dae8b6e993dd138ceaae942277a05c6beebb705a4f728bbe2c","bam_size_bytes":91263040,"chromosome":"chr18","dataset_id":"minos-chr18-031b9ed22a572248","fai_sha256":"1e9dac505c1b48f7a1ca90c5ec7e75ed257a19d4c03b21f4c40e4dfa29b806b5","feature_registry_hash":"0d8612707c6673060546511d8f5e8d1ba47048ef440e6c2dcf238fdc297f6e0c","identity_tuple_hash":"11a7b939a57e92baca674ddcc75c6c28454fac694f8c79d19dfa50c4d89f9201","parameter_space_hash":"605679294caea090c8a78a5c93f3b816cb2aff05251b33446a7e312e83c205fc","partition":"train","reference_sha256":"4c37db9609b3e865e35128fb065f61eea1c83c815386c4631b03820f9b8265d2","region_contig":"chr18","region_coordinate_system":"zero_based_half_open","region_end0_exclusive":80373285,"region_hash":"5e29a21a684490bdbb8965e29a005ae8839a6a55c0ac82c8882b279f3b8dfc7f","region_length_bp":80373285,"region_source":"chr18:0-80373285","region_start0":0,"round_id":"031b9ed22a572248","sort_order":5,"split_algorithm_version":"layer2-dataset-split-v1","split_salt":"minos-l2-split-v1"},{"allocation_digest":"f0319306ea15498f88c7cb3c6df10997b22ccfec041d7fae1539ec59d3b61922","bai_sha256":"97d859e71bf3790e168e649375269c8d5362626f19f81e2f77b721f65d2ab829","bam_sha256":"a11f7fa996ee6bfe79eb765d1f4fa6b19618a9abfcbea81d4c5740b2fd1ccba5","bam_size_bytes":86837843,"chromosome":"chr18","dataset_id":"minos-chr18-0f7636039ced5e18","fai_sha256":"1e9dac505c1b48f7a1ca90c5ec7e75ed257a19d4c03b21f4c40e4dfa29b806b5","feature_registry_hash":"0d8612707c6673060546511d8f5e8d1ba47048ef440e6c2dcf238fdc297f6e0c","identity_tuple_hash":"1c69cd6e7a6efe9da2bc818111635fc1fd7e7a1a18fbfb4bc005b83d541fef65","parameter_space_hash":"605679294caea090c8a78a5c93f3b816cb2aff05251b33446a7e312e83c205fc","partition":"test","reference_sha256":"4c37db9609b3e865e35128fb065f61eea1c83c815386c4631b03820f9b8265d2","region_contig":"chr18","region_coordinate_system":"zero_based_half_open","region_end0_exclusive":80373285,"region_hash":"5e29a21a684490bdbb8965e29a005ae8839a6a55c0ac82c8882b279f3b8dfc7f","region_length_bp":80373285,"region_source":"chr18:0-80373285","region_start0":0,"round_id":"0f7636039ced5e18","sort_order":14,"split_algorithm_version":"layer2-dataset-split-v1","split_salt":"minos-l2-split-v1"},{"allocation_digest":"c5429eb8f5811667973c57f7c01f129d4be3136ed5b0acd99b40acfae43187a2","bai_sha256":"923332e68ab88f01000e71138314cd78a991ed1d500c911c95a149f72d023c2b","bam_sha256":"d83cba6ae3026144b3556ff14bec6a0765c4a866cbd5725f09dcfdeb460473e1","bam_size_bytes":51702091,"chromosome":"chr18","dataset_id":"minos-chr18-266e9e3efe9bb8f3","fai_sha256":"1e9dac505c1b48f7a1ca90c5ec7e75ed257a19d4c03b21f4c40e4dfa29b806b5","feature_registry_hash":"0d8612707c6673060546511d8f5e8d1ba47048ef440e6c2dcf238fdc297f6e0c","identity_tuple_hash":"a1a53204fc8602b2821f55773c2397acc7095e2c9d2344a23e010e8fd5f81ce1","parameter_space_hash":"605679294caea090c8a78a5c93f3b816cb2aff05251b33446a7e312e83c205fc","partition":"validation","reference_sha256":"4c37db9609b3e865e35128fb065f61eea1c83c815386c4631b03820f9b8265d2","region_contig":"chr18","region_coordinate_system":"zero_based_half_open","region_end0_exclusive":80373285,"region_hash":"5e29a21a684490bdbb8965e29a005ae8839a6a55c0ac82c8882b279f3b8dfc7f","region_length_bp":80373285,"region_source":"chr18:0-80373285","region_start0":0,"round_id":"266e9e3efe9bb8f3","sort_order":11,"split_algorithm_version":"layer2-dataset-split-v1","split_salt":"minos-l2-split-v1"},{"allocation_digest":"ba0f94a26d498d22c93540a7633c58dc5d920aeb493e067bad29d18150b85ef3","bai_sha256":"6d86909f4219f76c9157dffb0058e5f04536b68e01cc6a7328054c34448ee556","bam_sha256":"6bb0115c4dce4df04c7b080abf1c43dabd1cb411aeadb3f35ca9ac0c356c465b","bam_size_bytes":127624692,"chromosome":"chr18","dataset_id":"minos-chr18-3567ff83fbc9de9a","fai_sha256":"1e9dac505c1b48f7a1ca90c5ec7e75ed257a19d4c03b21f4c40e4dfa29b806b5","feature_registry_hash":"0d8612707c6673060546511d8f5e8d1ba47048ef440e6c2dcf238fdc297f6e0c","identity_tuple_hash":"ee3ff782947ca42b56576e0cfc082291adf63c32e0f4790d70853ef96ac20eba","parameter_space_hash":"605679294caea090c8a78a5c93f3b816cb2aff05251b33446a7e312e83c205fc","partition":"train","reference_sha256":"4c37db9609b3e865e35128fb065f61eea1c83c815386c4631b03820f9b8265d2","region_contig":"chr18","region_coordinate_system":"zero_based_half_open","region_end0_exclusive":80373285,"region_hash":"5e29a21a684490bdbb8965e29a005ae8839a6a55c0ac82c8882b279f3b8dfc7f","region_length_bp":80373285,"region_source":"chr18:0-80373285","region_start0":0,"round_id":"3567ff83fbc9de9a","sort_order":9,"split_algorithm_version":"layer2-dataset-split-v1","split_salt":"minos-l2-split-v1"},{"allocation_digest":"13298feda7feb125ebfc97e041f680527aa23f57b887b95d30d36fac364ac55f","bai_sha256":"da005de8ea78ca0cf5a5c971f1da2ed37877119c2e9dd8164782d344c2f4f0b6","bam_sha256":"78fabd16f1da1b34dcda320b7d070607171c35d6376acfa6bc72cb3421ca221a","bam_size_bytes":83083706,"chromosome":"chr18","dataset_id":"minos-chr18-4041408c84aa1dd9","fai_sha256":"1e9dac505c1b48f7a1ca90c5ec7e75ed257a19d4c03b21f4c40e4dfa29b806b5","feature_registry_hash":"0d8612707c6673060546511d8f5e8d1ba47048ef440e6c2dcf238fdc297f6e0c","identity_tuple_hash":"1442c781aca30fb579fa57753ca3a53b069f4ac0490ad4087e8a56e5ea9c30ae","parameter_space_hash":"605679294caea090c8a78a5c93f3b816cb2aff05251b33446a7e312e83c205fc","partition":"train","reference_sha256":"4c37db9609b3e865e35128fb065f61eea1c83c815386c4631b03820f9b8265d2","region_contig":"chr18","region_coordinate_system":"zero_based_half_open","region_end0_exclusive":80373285,"region_hash":"5e29a21a684490bdbb8965e29a005ae8839a6a55c0ac82c8882b279f3b8dfc7f","region_length_bp":80373285,"region_source":"chr18:0-80373285","region_start0":0,"round_id":"4041408c84aa1dd9","sort_order":0,"split_algorithm_version":"layer2-dataset-split-v1","split_salt":"minos-l2-split-v1"},{"allocation_digest":"c558ba49a4557f89d80509de1e7f376806aa4911d581b88bc72662cafe62273c","bai_sha256":"c72b5d7119505f76464fca457aae13913c295d03f7cb9039ab16ba856b702ee1","bam_sha256":"9b68d395342cba5bada55877d0e6c6ad11f683a00e5430de3a550b761ec52c03","bam_size_bytes":169897725,"chromosome":"chr18","dataset_id":"minos-chr18-49a0587df4584484","fai_sha256":"1e9dac505c1b48f7a1ca90c5ec7e75ed257a19d4c03b21f4c40e4dfa29b806b5","feature_registry_hash":"0d8612707c6673060546511d8f5e8d1ba47048ef440e6c2dcf238fdc297f6e0c","identity_tuple_hash":"24fae6395145875cf893476e5594f2fb15106f15528b1639fb6a843995526be0","parameter_space_hash":"605679294caea090c8a78a5c93f3b816cb2aff05251b33446a7e312e83c205fc","partition":"test","reference_sha256":"4c37db9609b3e865e35128fb065f61eea1c83c815386c4631b03820f9b8265d2","region_contig":"chr18","region_coordinate_system":"zero_based_half_open","region_end0_exclusive":80373285,"region_hash":"5e29a21a684490bdbb8965e29a005ae8839a6a55c0ac82c8882b279f3b8dfc7f","region_length_bp":80373285,"region_source":"chr18:0-80373285","region_start0":0,"round_id":"49a0587df4584484","sort_order":12,"split_algorithm_version":"layer2-dataset-split-v1","split_salt":"minos-l2-split-v1"},{"allocation_digest":"39cbf572e96b1168193140cef9151f38488b61ced424bd20048b8e5737092c9a","bai_sha256":"cc41ac1e54ca96ea08f1e1c57c40b99301b34f8e53a9b021ac403485da4f40dc","bam_sha256":"a37dfe97fa2c668d51ad760918a2a90216af2f9143ab3c98dbc2fbd8eb5e0e4d","bam_size_bytes":95334877,"chromosome":"chr18","dataset_id":"minos-chr18-5e50748cb9a892f0","fai_sha256":"1e9dac505c1b48f7a1ca90c5ec7e75ed257a19d4c03b21f4c40e4dfa29b806b5","feature_registry_hash":"0d8612707c6673060546511d8f5e8d1ba47048ef440e6c2dcf238fdc297f6e0c","identity_tuple_hash":"c59620e15fc7c1746a4352b949c6d87548bea2ab7cc4cd935b7aac89eeeaa08b","parameter_space_hash":"605679294caea090c8a78a5c93f3b816cb2aff05251b33446a7e312e83c205fc","partition":"train","reference_sha256":"4c37db9609b3e865e35128fb065f61eea1c83c815386c4631b03820f9b8265d2","region_contig":"chr18","region_coordinate_system":"zero_based_half_open","region_end0_exclusive":80373285,"region_hash":"5e29a21a684490bdbb8965e